{
  "$schema": "https://intlayer.org/schema.json",
  "key": "comp-app",
  "title": "App component",
  "description": "Content declaration for the App component, containing markdown content, the markdown component reference, and markdown metadata used by the compiler.",
  "tags": ["component", "app", "markdown", "compiler"],
  "content": {
    "markdownContent": {
      "nodeType": "translation",
      "translation": {
        "en": "Markdown content",
        "fr": "Contenu Markdown",
        "es": "Contenido Markdown"
      }
    },
    "markdownComponent": {
      "nodeType": "translation",
      "translation": {
        "en": "Markdown component",
        "fr": "Composant Markdown",
        "es": "Componente de Markdown"
      }
    },
    "markdownMetadata": {
      "nodeType": "translation",
      "translation": {
        "en": "Markdown Metadata",
        "fr": "Métadonnées Markdown",
        "es": "Metadatos de Markdown"
      }
    }
  }
}
